<?xml version="1.0" encoding="UTF-8"?>
<clasificacion
xmlns:xsi="http://www.w3.org/2001/XMLSchema-instance"
    xsi:noNamespaceSchemaLocation="clasificacion.xsd">
    <fecha_expiracion>2022-06-05</fecha_expiracion>
   <temporada cod_temporada="1">
      <equipo cod_equipo="1" partidos_ganados="5">
      <nombre>G2</nombre>
      <lista_jugadores>
          <jugador>
            <nickname>BrokenBlade</nickname>
            <rol>TOP</rol>
          </jugador>
           <jugador>
            <nickname>Jankos</nickname>
            <rol>JGL</rol>
          </jugador>
           <jugador>
            <nickname>CaPs</nickname>
            <rol>MID</rol>
          </jugador>
           <jugador>
            <nickname>Flakked</nickname>
            <rol>ADC</rol>
          </jugador>
           <jugador>
            <nickname>Targamas</nickname>
            <rol>SUPP</rol>
          </jugador>
      </lista_jugadores>
    </equipo>
    <equipo cod_equipo="2" partidos_ganados="6">
      <nombre>FNATIC</nombre>
      <lista_jugadores>
          <jugador>
            <nickname>Wunder</nickname>
            <rol>TOP</rol>
          </jugador>
           <jugador>
            <nickname>Razork</nickname>
            <rol>JGL</rol>
          </jugador>
           <jugador>
            <nickname>Humanoid</nickname>
            <rol>MID</rol>
          </jugador>
           <jugador>
            <nickname>Upset</nickname>
            <rol>ADC</rol>
          </jugador>
           <jugador>
            <nickname>Hylissang</nickname>
            <rol>SUPP</rol>
          </jugador>
      </lista_jugadores>
    </equipo>
    </temporada>
</clasificacion>